date;id;text;negative;positive;sentiment
20/11/2018;1,06497E+18;Holiday season is right around the corner and this makes a GREAT GIFT for the classroom and your home.… https://t.co/5az9b1gYre;0;2;2
20/11/2018;1,06497E+18;"-&gt; https://t.co/Q0abAXNh7o &lt;- Blogging without a solid blog plan is like starting to homeschool without a curriculu… https://t.co/cRHvcwKWp4";0;2;2
20/11/2018;1,06497E+18;Free Javascript tutorials and online resources. #education #tech #homeschool https://t.co/qF42fx4zJo;0;1;1
20/11/2018;1,06496E+18;I have a YouTube channel where I answer viewer questions about geology. It is especially great for kids, teachers a… https://t.co/qzLiU9TDNd;0;1;1
20/11/2018;1,06496E+18;"Great idea! 

For the #parents out there that actually have the time to make snacks like this for your #kids :)

(w… https://t.co/k4XLEvDklD";0;2;2
20/11/2018;1,06496E+18;Homeschool Christian Mom is ready to encourage you. . .there is so much to home schooling! You are managing the hou… https://t.co/jczEe5qYfN;0;2;2
20/11/2018;1,06496E+18;@Thom_Hartmann I remember hearing about textbooks from 2015 TX saying slavery was just a side issue in the civil wa… https://t.co/DeotwShSsn;1;0;-1
20/11/2018;1,06496E+18;My man Dom is 3 years old and just started training Jiu Jitsu like 3 weeks ago. He is a little monster. He actually… https://t.co/Hcv7FeE8Wy;1;1;0
20/11/2018;1,06496E+18;3 easy ways to tear down a fellow homeschool mom - So easy and it happens all the time https://t.co/E3zPf3GqFR https://t.co/bAobJMaeyq;0;2;2
20/11/2018;1,06496E+18;I liked a @YouTube video https://t.co/qNyLMq2PSx Why We HOMESCHOOL;0;1;1
20/11/2018;1,06496E+18;VIDEO TUTORIAL: Linear Functions--Positive Slope, Zero Intercept. Learn the basics of linear functions in slope-int… https://t.co/6bh4bimmWQ;0;1;1
20/11/2018;1,06496E+18;I liked a @YouTube video https://t.co/3PJyHmCfgN First day of Homeschool!;0;1;1
20/11/2018;1,06496E+18;"Paul Lockart in A Mathematician's Lament -- \We learn things because they interest us now, not because they might b… https://t.co/XlUtlNbML6""";1;0;-1
20/11/2018;1,06496E+18;I liked a @YouTube video https://t.co/JkYYMkjxC2 Homeschool Day In The Life Of A Stay At Home Mom;0;1;1
20/11/2018;1,06496E+18;Fun science with a Thanksgiving theme! Instant download. Thanksgiving Science Experiments for kids #ad… https://t.co/uHSrscENDt;0;1;1
20/11/2018;1,06496E+18;Benefits of homeschooling your kids - https://t.co/bDWBaH6nyc #c2cEDU #c2csafety @VPTaskForce https://t.co/5qaFOC4NVN;0;1;1
20/11/2018;1,06496E+18;Here's a new deal you can get on Not Consumed – Save 20 – 60% site wide + get free shipping. Free gifts available w… https://t.co/u6gJTRwF57;0;3;3
20/11/2018;1,06496E+18;"Postcards, Announcements, and a #Giveaway Alert! You won't want to miss this! - [Campaign URL] 

We have so much to… https://t.co/e2krWHeyyk";1;0;-1
20/11/2018;1,06496E+18;"Here are some Great #Activities for #Science learning : \Believe it or not. Thanksgiving science is a thing. Wonder… https://t.co/3ck64dI9WI""";0;2;2
20/11/2018;1,06496E+18;Seeking a Suitable Education in an Unstable Era. https://t.co/oJ7EPJmLo7 #homeschoolteen #HomeschoolingTeen… https://t.co/uw1kZid9NZ;1;1;0
20/11/2018;1,06496E+18;Meet my reluctant reader. She has struggled with comprehension, she isn't interested in many books, she would rathe… https://t.co/AVoDH0DtVx;2;0;-2
20/11/2018;1,06496E+18;Do you feel overwhelmed in your homeschool?  Maybe it's time to get some help.  Check out the academic advising pro… https://t.co/dca3dAh3Mc;1;0;-1
20/11/2018;1,06496E+18;Alright, I get it, men get to have sick days and actually walk around like sick people... we have to just keep on k… https://t.co/ZxeZsgKzjq;2;1;-1
20/11/2018;1,06496E+18;Unvaccinated children should not be allowed at public schools unless they are allergic to vaccines. If you just don… https://t.co/LkbQ4BQCXP;1;0;-1
20/11/2018;1,06496E+18;"Available now … six festive Christmas resources that will turn your HOMEschooling into HOLIDAYschooling.

With the… https://t.co/66Zd8SPE34";0;2;2
20/11/2018;1,06496E+18;@InhaleNovichok @rooshv Not in a public school. All boy schools redesigned for maximum male success in modern condi… https://t.co/OzQsZEwQD0;0;2;2
20/11/2018;1,06496E+18;"Love giveaways? This one for homeschool moms is sweet!
https://t.co/ii2jyLTATN https://t.co/ii2jyLTATN";0;2;2
20/11/2018;1,06495E+18;My man Dom is 3 years old and just started training Jiu Jitsu like 3 weeks ago. He is a little monster. He actually… https://t.co/hxPDus8EYk;1;1;0
20/11/2018;1,06495E+18;Calling all Homeschool Moms Who Are Ready to Take Their Children To The Next Level!! https://t.co/R9E6HQQCDQ;0;1;1
20/11/2018;1,06495E+18;Homeschooling never sounded more attractive... https://t.co/DtSYLNzmuE;0;1;1
20/11/2018;1,06495E+18;@guardian She can always just homeschool him if she really wants him to become a heaving piece of intolerant crap.;1;0;-1
20/11/2018;1,06495E+18;"To celebrate #BlackFriday &amp; cyber Monday we are offering 25% off &amp; FREE domestic shipping! <U+0001F44F>
Our #resources are fan… https://t.co/LXE6N1FzZT";0;2;2
20/11/2018;1,06495E+18;@MKupperman Sorry. Wish homeschool wasn't looked down on so much.;1;0;-1
20/11/2018;1,06495E+18;This is a battle you cannot win with the current system. It was rigged 100 yr ago by the infiltration of the Humani… https://t.co/tJnxKHdTHj;0;1;1
20/11/2018;1,06495E+18;"Get the kids thinking thankfully with this #freeprintable. Thankful from A-Z. 
https://t.co/N3No1lqLb3

#thankful… https://t.co/CnDbL9cISX";0;2;2
20/11/2018;1,06495E+18;Being a mom of many can be stressful sometimes. Adding homeschooling to the mix just doubles the fun. <U+0001F609> Today on my… https://t.co/9TJ4Us0jmh;1;1;0
20/11/2018;1,06495E+18;@laurynmaria People like you are destroying the country with your PC ignorance. Homeschool your children to avoid t… https://t.co/ATAbKkNESd;1;1;0
20/11/2018;1,06495E+18;Get your #homeschool laughing with these funny YouTube channels. #ihsnet https://t.co/LFY0P8zxhc;1;0;-1
20/11/2018;1,06495E+18;I Know My Rights: A Children's Guide to the Bill of Rights and Individual Liberty is a fantastic tool to help kids… https://t.co/Ap5BwMbPFX;0;2;2
20/11/2018;1,06495E+18;@AsherLangton @AtticusGF While virtuously encouraging everyone to homeschool to save the nation;0;2;2
20/11/2018;1,06495E+18;Interesting to see what others thought about home schooling in today’s seminar- PPF #homeschooling #cardiffmet… https://t.co/1rxsGSXKyo;0;1;1
20/11/2018;1,06495E+18;School Board Overrules Parents Objections And Forces Through The Unthinkable https://t.co/dlP10Svso6 yes parents ha… https://t.co/6xNjCJLp0x;2;0;-2
20/11/2018;1,06495E+18;I liked a @YouTube video https://t.co/ynBRtnl5N9 Homeschool Day In The Life Of A Stay At Home Mom;0;1;1
20/11/2018;1,06495E+18;"It's sad that in America we have to jump thru hoops to homeschool children 

I don't want my brother being Brain washed";1;0;-1
20/11/2018;1,06495E+18;"#Parents! Help your child's #education. #Homeschool &amp; supplemental #K12 #school. Qualified #Lernsys teachers help.… https://t.co/9YUQXeq3QD";0;1;1
20/11/2018;1,06495E+18;Everyday it's not hard to find yet another reason to #homeschool https://t.co/MDy5yk96Nr;1;0;-1
20/11/2018;1,06495E+18;VIDEO: Algebra Applications: Systems of Equations, Segment 2: Encryption. Secret codes and encryption are ideal exa… https://t.co/F6ReuGziTr;0;1;1
20/11/2018;1,06494E+18;"\Blood is unavoidable at this point. As many as can pull their children out to homeschool is good…\"" — R Zella https://t.co/28oUOYQ7Yr""";0;1;1
20/11/2018;1,06494E+18;This is my reason for long days and crashing at 8 at night cause homeschooling and streaming and showing her what h… https://t.co/zNU2SqDLmA;1;0;-1
20/11/2018;1,06494E+18;The first of many copies are starting to arrive! Let me know when you get yours! Available now on #Amazon!… https://t.co/u6DhmtHl8C;0;1;1
20/11/2018;1,06494E+18;My Favorite Christmas Tradition - Make CHRISTMAS DAY Relaxing! #christmas #alldaybuffet https://t.co/rCAJFt6jeW https://t.co/Mak45hIGzU;0;1;1
20/11/2018;1,06494E+18;"8 Stocking Stuffers That Haven’t Been Done to Death  #gtchat #homeschool #parenting

\You know . . . small enough t… https://t.co/HGmGUxwaZK""";1;1;0
20/11/2018;1,06494E+18;Idiot Antifa coward..needs homeschooling..the hard way.. https://t.co/lrv7JgvKrl;3;0;-3
20/11/2018;1,06494E+18;It's deck building time in the game room! #mtg #magic #toomanycards #gametime #homeschool #deckbuilding… https://t.co/tThEIvnVzK;0;1;1
20/11/2018;1,06494E+18;"With simple text/beautiful illustrations, the \Jesus Loves Me More Than....\"" padded board bk encourages little ones… https://t.co/94NS5R0ZjL""";0;2;2
20/11/2018;1,06494E+18;6 Powerful Ways Nature Surpasses the Classroom https://t.co/bp2VKNF9ux #ihsnet #Homeschool https://t.co/fihAky0Knj;0;1;1
20/11/2018;1,06494E+18;My man Dom is 3 years old and just started training Jiu Jitsu like 3 weeks ago. He is a little monster. He actually… https://t.co/eLeKj3jaxn;1;1;0
20/11/2018;1,06494E+18;"New on ebay: Rosetta Stone® LEARN PORTUGUESE 1 2 &amp; 3 HOMESCHOOL 24 MONTH UNLIMITED + BONUS!… https://t.co/QbnVb2UzGk";0;2;2
20/11/2018;1,06494E+18;Our favorite #homeschool curriculum provider @OakMeadowBuzz has 15% off all K-12 curriculum and supplies November 2… https://t.co/dybJJye39u;0;1;1
20/11/2018;1,06494E+18;@f4ashygirl @baylez_ @flame2ash I homeschool, so she sneaks in there, plays with it, and thinks I won't notice the glitter trail!;0;1;1
20/11/2018;1,06494E+18;The Decision to Homeschool Led to One Mother’s Arrest https://t.co/YHDip2X85M  NY state has a lot of questionable t… https://t.co/jaPAeqZP0C;1;1;0
20/11/2018;1,06494E+18;@socioEqualiser @jaredlholt Yeah like homeschooling in my opinion should be done when they are later in their schoo… https://t.co/wMY3Y8TnXj;0;1;1
20/11/2018;1,06494E+18;Apparently, there is a pie-stealing llama in the next installment of The Little Troll (LT Kids this winter), it is… https://t.co/xyGgBIvur3;1;0;-1
20/11/2018;1,06494E+18;Budde Lee Clark’s stepmom followed homeschool law to the letter. She also isolated, manipulated, abused, and ultima… https://t.co/5o8lE4wlCO;2;0;-2
20/11/2018;1,06494E+18;We at SPED Homeschool are praying for God to provide in mighty ways. Please join us in prayer and let's watch God m… https://t.co/ztwbKG6iA9;0;1;1
20/11/2018;1,06494E+18;Great thing about homeschooling is the portability. We don't always do workbooks, but when we do it is usually in t… https://t.co/n2nCYcyy50;0;1;1
20/11/2018;1,06494E+18;You may feel that teaching your child at home might be too difficult a task to undertake. There are plenty of tools… https://t.co/tlfwf2VwXK;1;0;-1
20/11/2018;1,06494E+18;@side_nut great family channel they homeschool great community supporters check them out;0;2;2
20/11/2018;1,06494E+18;"3 Family Projects For Thanksgiving! Have some fun with your kids with these projects
https://t.co/KNHoasY4Py… https://t.co/8AmY9aTwNf";0;1;1
20/11/2018;1,06494E+18;"@socioEqualiser @jaredlholt Tbh I like the idea of homeschooling. 

The problem is when you have religious fundies… https://t.co/IR9ocL45n4";1;1;0
20/11/2018;1,06493E+18;@jaredlholt homeschooling is child abuse, change my mind. https://t.co/3NHVJpVQoQ;1;0;-1
20/11/2018;1,06493E+18;"Simplify Your Thanksgiving!
https://t.co/BUP5xCUrmF
#thanksgiving #simpleliving #homeschool #samh #family… https://t.co/7sKp17cqTb";0;1;1
20/11/2018;1,06493E+18;Three Perfect Gifts From Ellie Claire #FlyBy #art #momlife #homeschool #journal #bible https://t.co/nwHff3J1Ae;0;1;1
20/11/2018;1,06493E+18;What are some Christmas traditions your family has? Here are some of our family's. Also enter to win $500… https://t.co/XWtn8UMdie;0;1;1
20/11/2018;1,06493E+18;Hi I’m Alorie I like to draw animals I'm working on being a bit more active on here (aka actually posting art, heh)… https://t.co/McC4AD7VCP;0;1;1
20/11/2018;1,06493E+18;"Oooh.  Russia bad (just like Trump bad).  Yet Russia embraces homeschooling and the family.

https://t.co/T0cy2rzWGQ";2;2;0
20/11/2018;1,06493E+18;#Autism #autistic kids are vulnerable to transgendered kids to often groom other kids. Keep your kids away-… https://t.co/co6tr08b5Q;1;0;-1
20/11/2018;1,06493E+18;That really sucks if you can’t homeschool and people are insistant you can’t be part of the club. Cus you think som… https://t.co/RFv1Z8ZOwt;1;0;-1
20/11/2018;1,06493E+18;<U+0001F31E><U+0001F4DA>Interest Led Learning. The most freeing lesson that I have learned along the way is that homeschool does not have… https://t.co/DjH7XDx6Ja;0;1;1
20/11/2018;1,06493E+18;@Zepol_n_Feenix @Hornsby31 @SaRaAshcraft Totally agree!  The Teachers Union is helping to fund these protests... if… https://t.co/p1Bp2iXC2u;1;1;0
20/11/2018;1,06493E+18;@JackPosobiec Is it kid friendly? Thinking about adding one to Rory’s homeschool curriculum;0;1;1
20/11/2018;1,06493E+18;Okay so I’m catching up on many days of work with my homeschool student (since she’s been gone on a family trip) an… https://t.co/QA5pEJ15Km;0;1;1
20/11/2018;1,06493E+18;"Drawn To Discover; Improving Fine Motor Skills Through Drawing #homeschool https://t.co/MWmO5t3Rap #art #review";0;2;2
20/11/2018;1,06493E+18;Want to try homeschooling but scared? Here's why I did it. #homeschool #parenting https://t.co/8GRDXiyFfK;1;0;-1
20/11/2018;1,06493E+18;help support our homeschool and visit our #eBay store this Holiday Season #BlackFridayWeek ....we feature most exce… https://t.co/BIZpqqYGHu;0;1;1
20/11/2018;1,06493E+18;@drshenanigans Then they will still complain about what they are learning, well homeschool them yourself then or ge… https://t.co/5FAHUhb4WX;1;1;0
20/11/2018;1,06493E+18;This is how #homeschooling is going. Here is a model building (or something) built during grammar.  I'm glad we are… https://t.co/cV5HhSeOY7;0;1;1
20/11/2018;1,06493E+18;SAVE THE DATE: Join us on Nov 30 at the @UTAustin for some Cool Activities (5:30-6:40pm) and learn abt different an… https://t.co/8ur0VQYhRQ;0;1;1
20/11/2018;1,06493E+18;Beautiful nonfiction picture books like these make homeschool fun! https://t.co/NoUoMHd3zD;0;3;3
20/11/2018;1,06493E+18;"<U+0001F983> From Us To You: Happy Thanksgiving! Plus: Enjoy 10% Savings! 
Use Code: GOBBLEGOBBLE to Save Now Thru 11/30!… https://t.co/SVatT53MXu";0;3;3
20/11/2018;1,06493E+18;"In all the chaos of planning; moving, selling, homeschooling, working, setting up meetings and events for our 2019… https://t.co/ID0U5a91oi";1;0;-1
20/11/2018;1,06493E+18;Are you ready for #FREE access to these great #homeschool reading program resources? Download them now at… https://t.co/mNQkDF0fNH;0;3;3
20/11/2018;1,06493E+18;"Coming to a school near you!!
Liberalism is a mental disease.
God save us from this evil brainwashing our kids.… https://t.co/8xVBo050Dy";1;0;-1
20/11/2018;1,06493E+18;i hate homeschool lmao jdkdoxjsoz;1;0;-1
20/11/2018;1,06493E+18;@OrwellNGoode Yep. I am going to homeschool mine. Will save them years of deprogramming and suffering that I had to… https://t.co/GdZBftqYQM;1;0;-1
20/11/2018;1,06493E+18;"If you willfully send your children to a govt run \schooling\"" system, you deserve dumb kids .... ";;;
20/11/2018;1,06492E+18;Enter to win a #homeschool typing program from @typesyapp at Life of a Homeschool Mom! 10 winners! #giveaway https://t.co/Zjc2ghkieN;0;2;2
20/11/2018;1,06492E+18;"Many of you celebrated an early Thanksgiving last weekend.<U+0001F983>
Some of you took a break from being online.<U+0001F4F5>
Some of yo… https://t.co/iGgrDqj1b4";1;1;0
20/11/2018;1,06492E+18;Have a little art lover? Maybe a young artist. Check out this fun arty gift guide filled with awesome art-filled gi… https://t.co/zbbfVaeOZ2;0;3;3
20/11/2018;1,06492E+18;VIDEO: Algebra Applications: Systems of Equations, Segment 1: Profit and Loss. A system of equations that includes… https://t.co/3EjDUDhJa5;1;0;-1
20/11/2018;1,06492E+18;homeschool sounds great lmao;0;1;1
20/11/2018;1,06492E+18;My man Dom is 3 years old and just started training Jiu Jitsu like 3 weeks ago. He is a little monster. He actually… https://t.co/HYeaXxAgS9;1;1;0
20/11/2018;1,06492E+18;Why would anyone take their child out of school or choose home education from the start? What are the benefits?… https://t.co/6aWhyXLyut;0;1;1
20/11/2018;1,06492E+18;I Know My Rights: A Children's Guide to the Bill of Rights and Individual Liberty is a fantastic tool to help kids… https://t.co/d94rPhBGnq;0;2;2
20/11/2018;1,06492E+18;Textbook Education on colonization is full of so many lies.  #HomeSchool #TeachtheTruth https://t.co/722z2CVDtf;1;0;-1
20/11/2018;1,06492E+18;What do you need to homeschool well? https://t.co/BjQbeJzMY7 #homeschool https://t.co/n0xTwwtHbG;0;1;1
20/11/2018;1,06492E+18;FREE - Garden Planner Printable - Homeschool Gardens https://t.co/HV5xjSh2XQ https://t.co/RAOAqSf3NC;0;1;1
20/11/2018;1,06492E+18;My man Dom is 3 years old and just started training Jiu Jitsu like 3 weeks ago. He is a little monster. He actually… https://t.co/d9YynQOohh;1;1;0
20/11/2018;1,06492E+18;"I love when that happens...
.
.
.
.
.
.
#homeschool #homeschooling #homeschoolmom #homeeducation #homeschoolfamily… https://t.co/jQ3stY0xZG";0;1;1
20/11/2018;1,06492E+18;@aced_esports What did you expect from him then I mean it's not like he's gonna be doing a lot of the content becau… https://t.co/cvvrFVRFsM;0;1;1
20/11/2018;1,06492E+18;Weekly Spotlight Event. Get Ready for #GivingTuesday with @SeaTurtleInc.  Learn how you can join our community at… https://t.co/yFZfyd2N92;0;1;1
20/11/2018;1,06492E+18;@littlemissfuns1 Omg and she is homeschooling Marisa poor kid.  JE. Your a fucking idiot;3;0;-3
20/11/2018;1,06492E+18;Love is Patient, Love is Kind.  Free Printalbe Bible Verse Bookmarks #kidmin  #homeschool @CraftyClassroom Love Bib… https://t.co/SZEn0xYUxH;0;5;5
20/11/2018;1,06492E+18;"DO YOU WANT TO BE IN THE MUSIC VIDEO for #MulticulturalChildrensBookDay ? It’s easy &amp; fun. Read the instructions. (… https://t.co/dgDmjwSdSF";0;2;2
20/11/2018;1,06492E+18;@Kyla12061394 @PBandJenelley_1 I homeschool 3 high schoolers. It’s been great and I have a great relationship with… https://t.co/DZ80qzigq6;0;2;2
20/11/2018;1,06491E+18;Creating easy numbers for making addition easier for kids. https://t.co/wFPWibtqgl #addition #math Learningmole #homeschooling education;0;2;2
20/11/2018;1,06491E+18;"Here are some of the top questions (+ answers) asked by those expressing curiosity &amp; concerns about homeschooling.… https://t.co/YztDuvY4i0";1;1;0
20/11/2018;1,06491E+18;Looking for the best Christmas books for kids? Check out this awesome selection of Christian Christmas books: Adven… https://t.co/exa8ZgefBV;0;2;2
20/11/2018;1,06491E+18;"Best way to learn cell structures!!!
I'm saving for a homeschool lesson!!

<U+0001F44D><U+0001F44D><U+0001F44D>
@BTS_twt inspires learning!!!<U+0001F600><U+0001F600><U+0001F600> https://t.co/GG4EhDtJay";0;1;1
20/11/2018;1,06491E+18;Sharing... Sara explains how five tricks will help you conquer procrastination and establish and consistent… https://t.co/AGjr52rPkW;1;1;0
20/11/2018;1,06491E+18;Complete Haggard Collection: Best known as the author of King Solomon's Mines, Haggard was a prolific writer of adv… https://t.co/NcIwiKpXcd;2;2;0
20/11/2018;1,06491E+18;"<U+21E2><U+21E2>

     everything is all in one place to accommodate you! I have studies I’m still doing, but it’s more like home… https://t.co/ltp96hLBoX";0;1;1
20/11/2018;1,06491E+18;Homeschool Sisters on the Road: Friendship + Awesome Adulting {Episode 55} | The Homeschool Sisters Podcast https://t.co/XehkvtwGBJ;0;1;1
20/11/2018;1,06491E+18;@Pollyesther34 @SparklepantsMil @MattWalshBlog We homeschool as well. Pulled him from third grade. That was the best decision ever.;0;2;2
20/11/2018;1,06491E+18;#schoolchoice supporters are parents, students, teachers, organizations and individuals that are passionate about c… https://t.co/KQlQdJrVot;0;1;1
20/11/2018;1,06491E+18;@goingblondzo And homeschooling is very popular here because the public schools aren’t very good and the private schools are like $40k.;0;3;3
20/11/2018;1,06491E+18;@goingblondzo It definitely depends on the type of homeschooling. It may be more difficult for you if you live in t… https://t.co/8nx62bMSm1;1;0;-1
20/11/2018;1,06491E+18;"\What's an average day of unschooling look like? I don't know\"" - Brian, an unschooler";;;
20/11/2018;1,0649E+18;"\I am so excited to finally have a wonderful resource for all your baby, toddler, and multiple ages questions.\""… https://t.co/OJIhIDahdY""";0;2;2
20/11/2018;1,0649E+18;Excel student, Sara, built, researched and shared her Tinker Crate Kinegram (a moving picture that combines slices… https://t.co/AcddLmq6wJ;0;1;1
20/11/2018;1,0649E+18;Make plans NOW to attend the 2019 Birmingham Homeschool Fair and Convention!  #BHCFAIR19 Get all the details HERE!… https://t.co/UCxiYYsT3D;0;1;1
20/11/2018;1,0649E+18;Three steps to handwriting success #handwriting #spedhomeschool #homeschooling #homeschool #writing… https://t.co/sAw3Cor8jT;0;1;1
20/11/2018;1,0649E+18;@LionelMedia I have no motivation to encourage my kids to go to college. Zero ... Zip ... Ziltch ... None ... I am… https://t.co/8mPOSH4YKC;0;1;1
20/11/2018;1,0649E+18;Guess who's having a North pole breakfast party on the 1st? We're so excited here is today's efforts. Santa sweet s… https://t.co/m2Y55rbBk7;0;2;2
20/11/2018;1,0649E+18;Top 10 Goals for Homeschool Middle School https://t.co/ur8TmQntjg;0;1;1
20/11/2018;1,0649E+18;No Homeschool, No End of Year Panic! https://t.co/W7Uvo5MyPB #education #Parenting #Homeschooling https://t.co/cel88vEvTk;1;0;-1
20/11/2018;1,0649E+18;Homeschool Highschool Podcast Episode 54: Conquering Crunchtime Craziness https://t.co/Img25Fm05J;1;0;-1
20/11/2018;1,0649E+18;We're giving away 3 free months of ClassicalU access by giving you the opportunity to talk about what you love— cla… https://t.co/WOlnVhEBi5;0;2;2
20/11/2018;1,0649E+18;@LOUISE67893108 @420Texasmade Yup definitely! It’s sad because she yanked her oldest out of school to “homeschool”… https://t.co/vbRnsAqLWM;1;0;-1
20/11/2018;1,0649E+18;Our homeschool is on break this week...except that one kid who decided not to finish his school last week. He is no… https://t.co/IeTWTQnhJq;1;0;-1
20/11/2018;1,0649E+18;@AustinSlawinski I'd gladly turn your kids against you. Guess you'll have to homeschool yours so you can pass along… https://t.co/7XgBQkvCWY;0;1;1
20/11/2018;1,0649E+18;Going Deeper With Gratitude |  Sometimes what our kids need to develop grateful hearts, is to be in need of somethi… https://t.co/u1lhmUTezN;0;2;2
20/11/2018;1,0649E+18;"Mini Me Geology is proud to offer the best rock &amp; mineral kit, fossils, accessories and books for kids, teachers, h… https://t.co/qt8qRXquzd";0;2;2
20/11/2018;1,0649E+18;"Today at IPPL:
12pm: Homeschooling SMART: Hibernating Nature
More upcoming events:
https://t.co/9A3x4dWwDB";0;1;1
20/11/2018;1,0649E+18;4 Reasons To Never Regret Homeschooling No Matter What! https://t.co/EuHdLqS1c3 via @anawillis;1;0;-1
20/11/2018;1,06489E+18;@Jeanshelley5 I don't have children at school and my grand kids are homeschooling, but I worry. I believe we are ju… https://t.co/94EMIiTzsj;1;1;0
20/11/2018;1,06489E+18;@Nicole_Cliffe Maybe it's being neuroatypical, maybe it was the homeschooling, but I never even took that into cons… https://t.co/hXdpA7WSdF;1;0;-1
20/11/2018;1,06489E+18;25 Favorite Christmas Books the Whole Family Will Love #kidlit #Christmas #homeschool #ihsnet  https://t.co/GD34Bs6yMU via @Erin_Vincent35;0;2;2
20/11/2018;1,06489E+18;Are any of ya'll looking for ways to make your homeschool more literature-rich? Here are 7 easy-to-implement tips!… https://t.co/1ROs8Me1HK;0;2;2
20/11/2018;1,06489E+18;@AngeI_RedHead @Katy_K_Eliza @PBandJenelley_1 Another PRIVATE school. She is too good for public school, they had t… https://t.co/kLWWcJPqqB;0;1;1
20/11/2018;1,06489E+18;Many of my clients have found online school more time-consuming than pure homeschooling. This article delves into i… https://t.co/PsW31WsxEv;0;1;1
20/11/2018;1,06489E+18;#CharterSchools--are not offering a 'good' education--they are controlled by the corrupt government. Homeschooling-… https://t.co/6o5TyvXXNO;1;1;0
20/11/2018;1,06489E+18;"Oldest: \Did you know that Prussia attacked Denmark? That's so sad! That's where the Lego headquarters is now!\""… https://t.co/GXh0C9qH5R""";1;0;-1
20/11/2018;1,06489E+18;It is so incredibly important to teach good character in our children! Find out why Melanie from @wildlyanchored fi… https://t.co/LJ46V3bh2W;0;3;3
20/11/2018;1,06489E+18;Check out these art history apps. They're a good addition to your art curriculum. #homeschool #ihsnet https://t.co/IzDLBFwQNG;0;1;1
20/11/2018;1,06489E+18;I Know My Rights: A Children's Guide to the Bill of Rights and Individual Liberty is a fantastic tool to help kids… https://t.co/HfXMxrwMfj;0;2;2
20/11/2018;1,06489E+18;"\Leftwing freedom caucus. War is peace.  Freedom is slavery. <U+0001F644>If not for Dems trying to…\"" — Homeschool Momma https://t.co/icmD9Rf4UV""";0;3;3
20/11/2018;1,06489E+18;Beyond thankful my parents (and family as a whole), college pastor and early career mentors encouraged my ambition… https://t.co/RsbeIPgO9q;0;1;1
20/11/2018;1,06489E+18;Count your blessings and celebrate them! #MakeEveryDayAHoliday #LoveNotes #OnMyWalkWithGod  #amwriting #homeschool… https://t.co/3jjlvvnQeb;0;1;1
20/11/2018;1,06489E+18;Rest is Important when You Homeschool https://t.co/V09oAhGGQf;0;1;1
20/11/2018;1,06489E+18;@PBandJenelley_1 Lots of people homeschool, that shouldn't be the issue.;1;0;-1
