date;id;text;negative;positive;sentiment
20/11/2018;1,06468E+18;Help! My Child HATES Being Homeschooled! https://t.co/yuJtGKvilb via @redheadmom8 #homeschool #ihsnet;1;0;-1
20/11/2018;1,06468E+18;"These colorful little turkeys are super easy to make &amp; are also a great fine motor skills activity for toddlers and… https://t.co/6jrPovyqeG";0;5;5
20/11/2018;1,06468E+18;Greet all with God's love. #ThisIsTheDayTheLordHasMade #OnMyWalkWithGod #amwriting #bibleverseoftheday #bibleverse… https://t.co/tD8FrZ0Iy1;0;1;1
20/11/2018;1,06468E+18;"Tips for #homeschooling parents on how to make your child’s math FUN!

https://t.co/yrkCtdwNBs";0;1;1
20/11/2018;1,06468E+18;Cookie Crumb Fun - Journey with me in marriage, motherhood, homeschool , big family life and Trim Healthy Mama.… https://t.co/QAuaH1zuFT;0;2;2
20/11/2018;1,06468E+18;"Easy guide to the Bill of Rights; accessible; great for elementary and middle schoolers; fun illustrations; civics;… https://t.co/28kKVVRFdH";0;4;4
20/11/2018;1,06468E+18;The Decision to Homeschool Led to One Mother’s Arrest https://t.co/J6RqLHW8sW;0;1;1
20/11/2018;1,06468E+18;At the end of the day from sensory input overload. 13 is kinda like a mire socially aware Sheldon cooper. Rules law… https://t.co/VZXjygjPv9;1;1;0
20/11/2018;1,06468E+18;<U+0001F534> LIVE Tonny Boom All Episode | Early Childhood Education | Homeschool: https://t.co/R38PZJdgxr via @YouTube;0;1;1
20/11/2018;1,06467E+18;@clydetombaugh @billieeilish @kevinandbean @kroq Is she doing homeschool right now or is she taking a break for tour?;1;1;0
20/11/2018;1,06467E+18;Want awesome Cyber Monday deals on homeschool curriculum? I've just updated my monthly sales post with Cyber Monday… https://t.co/BRIRohK6qQ;0;1;1
20/11/2018;1,06467E+18;#Final Culver Junior Varsity 47, Indianapolis Homeschool Junior Varsity 25. Skurdenis led the way with 20 points. B… https://t.co/U7gxdVX3iV;0;1;1
20/11/2018;1,06467E+18;@jeffwilsontech @nhannahjones In addition to busing which wasn't just an issue in Boston but in a lot of places.  S… https://t.co/6gmxcRUHTr;1;0;-1
20/11/2018;1,06467E+18;That's insane! We need to sooo sending our children to the schools that are teaching liberal  ways! Homeschool your… https://t.co/CxiUudYeBw;1;0;-1
20/11/2018;1,06467E+18;@terilewlew @ljeanlisby Is Maryssa calling the shots in that home? She “was uncomfortable” in school so homeschooli… https://t.co/lkA6n7kIHQ;1;0;-1
20/11/2018;1,06467E+18;@IvankaTrump What are imminent plans for parents when egregious unconscionable Constitutional rights violations, de… https://t.co/wHY3k1kfuF;1;0;-1
20/11/2018;1,06467E+18;"Name game courtesy of A Better Way to Homeschool.

What are your kids nicknames? https://t.co/8Taj72YdWK";0;1;1
20/11/2018;1,06467E+18;Damn this wild, if u don’t vaccinate ur kids u should homeschool fosho. I don’t have anything against ppl’s parenti… https://t.co/HIov5CnSDh;2;0;-2
20/11/2018;1,06467E+18;LAST CHANCE! The Thinking Kids Press THANK YOU Sale ends at midnight PST TODAY, Monday: Save 35% on tools to teach… https://t.co/j5LCVmMZdd;0;1;1
23/11/2018;1,06612E+18;One of the dreaded grammar concepts to teach and master is when to use who vs. whom. Free worksheet to help… https://t.co/ErW2tUgc6j;0;2;2
23/11/2018;1,06612E+18;@getongab @NewPatriotUSA Homeschool is the only way to protect our kids and monitor what they are taught.;0;1;1
23/11/2018;1,06611E+18;@Ben_Sharp_ @getongab I need an even private schools can have their bias, that being said as somebody who was home-… https://t.co/XhlEUVWE2h;1;0;-1
23/11/2018;1,06611E+18;"Using Play to Support children... Newest Blog Post

https://t.co/x4joknyyNV

#play #learn #teacher #Homeeducated… https://t.co/Got17dvSUq";0;1;1
23/11/2018;1,06611E+18;"DO YOU WANT TO BE IN THE MUSIC VIDEO for #MulticulturalChildrensBookDay ? It’s easy &amp; fun. Read the instructions. (… https://t.co/d9mNSdqnqI";0;2;2
23/11/2018;1,06611E+18;MATH GAME: Interactive Math Game--Turkey Whack: Odd Numbers. Turkeys are taking over! Whack a turkey with an odd nu… https://t.co/O3fS4Dcm01;2;0;-2
23/11/2018;1,06611E+18;"Homeschooling #Parent Lesson 3: Empathy

Here's how to teach your kids (especially the older ones) Empathy (not tau… https://t.co/gJu2K5P1qv";0;2;2
23/11/2018;1,06611E+18;These YouTube channels with trigonometry videos can help your teen with challenging math topics. #homeschool… https://t.co/Q9j56PXgSu;1;0;-1
23/11/2018;1,06611E+18;"@DavidJHarrisJr Sick people! 
Homeschooling is not easy, but I will not have it any other way!";1;1;0
23/11/2018;1,06611E+18;One of my all time favorite things to make from scratch is bread and rolls. Sharing an easy rolls recipe that is pe… https://t.co/8QbPDqi35q;1;2;1
23/11/2018;1,06611E+18;#Parenting and #homeschooling #teens isn't always easy, but sometimes we as parents are the ones who make it harder… https://t.co/2ATFxt6bvZ;0;1;1
23/11/2018;1,06611E+18;"Traveling with Kids: Remember to Bring Audio Books &amp; a Big Travel Mug of Patience #ihsnet #kids #travel #traveling… https://t.co/b3ysEv6TIe";0;1;1
23/11/2018;1,06611E+18;"@mapleskyy @Lara53049065 @Drag0nsVsPed0s Homeschool, I can’t stress this enough,
We have to get our kids out of the public schools - period";1;1;0
23/11/2018;1,06611E+18;Homeschool Highschool Podcast Ep 97: Hard Conversations with Homeschool Teens https://t.co/A5SXUbX7dk;1;0;-1
23/11/2018;1,06611E+18;Just added this fun Holiday #Homeschooling list on Amazon! https://t.co/x4AB22Sge3 #ihsnet;0;1;1
23/11/2018;1,06611E+18;MATH GAME: Interactive Math Game--Algebra Jeopardy: Integers. Use this Jeopardy-style math game to review integer o… https://t.co/xtXjFCVm2q;2;0;-2
23/11/2018;1,06611E+18;COLOURFUL TREE BEAN BAG TOSS FUN #homeschool https://t.co/PucycmqRKs #math #sports;0;1;1
23/11/2018;1,06611E+18;@readingeggs has a great online program to help your child learn to #read, but have you checked out their new… https://t.co/xjRo7zhtpe;0;1;1
23/11/2018;1,06611E+18;I love this bc the Weasleys are quirky and chaotic and endearing and full of love and heckin talented and awesome i… https://t.co/XLOqEoLUyp;1;5;4
23/11/2018;1,06611E+18;@ForAmerica @nbc @Macys Wait - have your kids seen straight people kiss? There is nothing different. It's a shame y… https://t.co/eP2UMn9Yku;1;0;-1
23/11/2018;1,06611E+18;Enter to #win National Geographic Kids Weird But True! Mega Prize Pack #giveaway #educational #natgeokids #books… https://t.co/Iw5Zbmty2u;1;2;1
23/11/2018;1,06611E+18;Hey Facebook!  Just 6 hours left in our Black Friday free Homeschooling for College Credit Kindle download!! Homesc… https://t.co/CEQIoBb9Ar;0;1;1
23/11/2018;1,06611E+18;@osamahmirza @malloy_john Well I'm not sure that homeschool is the answer, nor is it an option for everyone, but th… https://t.co/a2Q3Gks2bm;0;1;1
23/11/2018;1,0661E+18;"@ruthinrevolt Thank you, Ruth, for being so generous and kind.
My name is Willy and I just started my blog, You Are… https://t.co/2gbSTBVzbl";0;2;2
23/11/2018;1,0661E+18;Seriously! The greatest meal of all time and you'll only eat a bun! #facepalm https://t.co/cJmaOiqoai;0;1;1
23/11/2018;1,0661E+18;"\Perhaps one of the greatest gifts we can give our children is to let them see that we have personal limitations.\""… https://t.co/e48r0NsVMQ""";1;1;0
23/11/2018;1,0661E+18;Do you think that you're too busy to homeschool? See how you can make it work with a packed schedule!… https://t.co/Y36LLAQW1v;0;1;1
23/11/2018;1,0661E+18;@DavidDTSS SMH, homeschool is what I did with my youngest, right after the Columbine shooting.;0;1;1
23/11/2018;1,0661E+18;41 Experts Share on the Pros and Cons of Homeschooling https://t.co/qjuUvn1kty #homeschooling;1;1;0
23/11/2018;1,0661E+18;Get our Introductory Science Video Course for FREE when you buy a workbook and answer key. Just use discount code B… https://t.co/dMtGruFCiv;0;1;1
23/11/2018;1,0661E+18;Here's one source of #homeschool curriculum at a great price! #homeschooling https://t.co/gzpAGLsioh;0;1;1
23/11/2018;1,0661E+18;I Know My Rights: A Children's Guide to the Bill of Rights and Individual Liberty is a fantastic tool to help kids… https://t.co/ot94Zy09Wi;0;2;2
23/11/2018;1,0661E+18;Mr Light's birthday present to me: came home from homeschool co-op with the kids and he's ripped out our kitchen fl… https://t.co/VeEgaL4oM4;1;0;-1
23/11/2018;1,0661E+18;Enter to #win National Geographic Kids #Books Holiday Prize Pack #giveaway #educational #natgeokids #homeschool https://t.co/Qvs6hSePiG;0;2;2
23/11/2018;1,0661E+18;Check out these #crafts, activities, and #printables you can use during your #brain or nervous system unit study!… https://t.co/e0IuIhXHZq;1;0;-1
23/11/2018;1,06609E+18;MATH GAME: HTML5 Interactive Game: The Discriminant. In this Drag-n-Drop activity match the quadratic equation to t… https://t.co/0Xl8zaGBJe;1;0;-1
23/11/2018;1,06609E+18;This resource is a gem for #homeschooling parents in need of a boost! Our library of archived #webinars offers tips… https://t.co/2G9C7nbu6c;0;2;2
23/11/2018;1,06609E+18;Just Pinned to Homeschooling 101: How to Make Geography Fun for Everyone! Games, books, and videos that teach geogr… https://t.co/wZ3ecjMRVS;0;1;1
23/11/2018;1,06609E+18;@ircrc @DrStaceyPatton I didn’t know then that it was abusive, as I heard similar methods promoted in sermons, book… https://t.co/5yCvkcPIsG;1;0;-1
23/11/2018;1,06609E+18;How to Make Geography Fun for Everyone! Games, books, and videos that teach geography. #homeschool # https://t.co/JzmUyjEqvo;0;1;1
23/11/2018;1,06609E+18;@brycetache Listing homeschool books for sale, cleaning, brushed up on rusty orgo, hanging with the kids, picking u… https://t.co/qVDtyMslCn;1;0;-1
23/11/2018;1,06609E+18;"117 best book movie adaptations for kids, teens, &amp; families. Awesome picture books, kids books, &amp; young adult books… https://t.co/jZf3gpQL5y";0;2;2
23/11/2018;1,06609E+18;Whether you homeschool or send your kids to a public or private school, it’s a good idea to periodically take stock… https://t.co/VwAfaw7SUo;0;1;1
23/11/2018;1,06609E+18;@Alyssa_Milano Kinda your fault for not homeschooling.;1;0;-1
23/11/2018;1,06609E+18;5 Ways to Raise a Natural Geography Lover https://t.co/rXDTmdyDLr #ihsnet #homeschooling #geography https://t.co/Iw9rY9Q83T;0;1;1
23/11/2018;1,06609E+18;@Drunk_Austen (Which makes me sad because it seems like the bulk of the homeschooling labour falls on mothers, and… https://t.co/HavucEs54n;2;1;-1
23/11/2018;1,06609E+18;Always ready to express themselves... #kids #family #homeschool #fun #blackandwhite #kidsphotography #inspiration… https://t.co/iCWsk5S5z4;0;3;3
23/11/2018;1,06608E+18;"The kiddos are loving our dinosaur-themed word cards <U+0001F995><U+0001F60D> 
https://t.co/oee7iFRBEC #homeschooling #dinosaurs https://t.co/TGCkLgdEmX";0;1;1
23/11/2018;1,06608E+18;"We've had a great month learning about the world around us!

https://t.co/qmaaeyTCFv
#homeeducation… https://t.co/pX5ZPnrDTX";0;1;1
23/11/2018;1,06608E+18;Agreed, I can clearly see that our society is evolving much faster while the curriculum and padagogies are lagging.… https://t.co/Dzf7Ptn7Go;1;2;1
23/11/2018;1,06608E+18;Perfect picks for your Christmas List! <U+0001F4DA><U+0001F384><U+0001F936><U+0001F385>. Adventure for all ages! https://t.co/xjX7uBJTbK  5<U+2730> #kidlit… https://t.co/28zLAdXymL;0;1;1
23/11/2018;1,06608E+18;Ed4Credit is perfect for #homeschooling teenagers! #onlineed #college #credit #courses https://t.co/2abdbl7eAZ;0;1;1
23/11/2018;1,06608E+18;Congratulations to Adam! You won a Family Convention Registration/4 Special Event Tickets from Great Homeschool Con… https://t.co/ffGCWl8JjR;0;3;3
23/11/2018;1,06608E+18;"Life, Liberty &amp; the Pursuit of Education: The Homeschooling Option
-Americans have lost faith in the public school… https://t.co/4kzlkiM5zm";1;2;1
23/11/2018;1,06608E+18;@PlayPartyPlan @whiskynsunshine So glad to know I’m not alone!!  And, I homeschool. Double whammy. <U+0001F602><U+0001F602><U+0001F62D><U+0001F62D>;0;1;1
23/11/2018;1,06608E+18;@scottlay @RyanTrabuco @DrPanMD He campaigned on “Parental Choice” - a much broader category in which the right to… https://t.co/FyZZOkDhOE;0;1;1
23/11/2018;1,06608E+18;Clearing out homeschool clutter? Don't dump it, swap it! List it on our Secular Swap part of the forum!… https://t.co/ll9FlujN4O;1;0;-1
23/11/2018;1,06608E+18;@bornbama72 @Astartiel @ForAmerica @nbc @Macys Please, for the love of god, tell me you don’t homeschool..;0;1;1
23/11/2018;1,06608E+18;@marlowned @MagsVisaggs I learned about gay ppl when I was 8 and my homeschool group boycotted the fall festival at… https://t.co/xUKSqB4i0W;1;0;-1
23/11/2018;1,06608E+18;If there is one thing I feel pretty passionately about when it comes to education, it’s that your child does not ha… https://t.co/2E5ibdVaQK;0;2;2
23/11/2018;1,06608E+18;Want to help your child to be a better #problemsolver? If at first you don’t succeed, draw, #draw again! Making a d… https://t.co/J2vxg2ldOw;0;2;2
23/11/2018;1,06608E+18;Lovely to see this feedback on my @WritersCentreAU Kids' Creative Writing Quest! Thank you so much Sarah! Next ques… https://t.co/yd05tCHpFb;0;3;3
23/11/2018;1,06607E+18;Is My Child a Reluctant Learner? | Homeschool Gameschool https://t.co/8Obt2scl5q;1;0;-1
23/11/2018;1,06607E+18;@notmuchofahw Hi! <U+0001F44B><U+0001F3FB> Heather here from The Parenting Patch. I blog, homeschool, bake, and all that jazz. I like rub… https://t.co/WquZxDLu0h;0;1;1
23/11/2018;1,06607E+18;"Find the best deals all in one post! #hsbloggers #BlackFriday 
Read it: https://t.co/spKAmKP7Vz";0;1;1
23/11/2018;1,06607E+18;Give Ana Willis just one hour a day for 5 days and she will change your homeschool for the better! 40% off this wee… https://t.co/qmnUnlIb08;0;1;1
23/11/2018;1,06607E+18;"This Holiday Sale is Still Hot! Enjoy 10% Savings! 
Use Code: GOBBLEGOBBLE to Save Now Thru 11/30! 
Shop Now:… https://t.co/wxmgl1ahUW";0;3;3
23/11/2018;1,06607E+18;Like the teachers unions have the magic option for education, private schools, charter schools, and homeschool most… https://t.co/jEtyHi1mlp;0;2;2
23/11/2018;1,06607E+18;Sick day for the kids included colouring and beading (art), Beatles Rock Band (music), and the Narnia movies (langu… https://t.co/mUalnbrGQj;1;0;-1
23/11/2018;1,06607E+18;"Only 4 days until Giving Tuesday!  Are you ready to donate and win? 

#givingtuesday #donate #homeschooling… https://t.co/x9K2NZNU8D";0;2;2
23/11/2018;1,06607E+18;"The Myth of Institutionalized Learning https://t.co/5lhv9DAwOJ
#homeschool #life #kids #love #homeschooling… https://t.co/MOigr51VsN";1;1;0
23/11/2018;1,06607E+18;Are you ready for #GivingTuesday?  We are, and so are these amazing organizations who have #donated thousands of do… https://t.co/osmFYEO4tC;0;2;2
23/11/2018;1,06607E+18;Enter to #win National Geographic Kids Weird But True! Mega Prize Pack #giveaway #book #educational #homeschool… https://t.co/IfGRWZWvx1;1;2;1
23/11/2018;1,06607E+18;You can listen to downloaded audiobooks on your phone or tablet with these handy audiobook player apps. #homeschool… https://t.co/4PSeXDXwlc;0;1;1
23/11/2018;1,06607E+18;I Know My Rights: A Children's Guide to the Bill of Rights and Individual Liberty is a fantastic tool to help kids… https://t.co/omHhDZC0Ug;0;2;2
23/11/2018;1,06607E+18;"@CharliiamMay @thecjpearson Dens of indoctrination stopped \educating\"" when they allowed their so-called *teachers*… https://t.co/k7tEwT8UXL""";1;0;-1
23/11/2018;1,06607E+18;2016 Homeschool Review Crew Blue Ribbon Awards - Favorite History Supplement https://t.co/NBTUXnfCS4 @caroleproman https://t.co/i6cGhBuOIC;0;2;2
23/11/2018;1,06606E+18;@bouldercolorado @boulderlibrary Avoid this garbage and homeschool your children!;1;0;-1
23/11/2018;1,06606E+18;@ricklgodwin so glad we do #homeschool;0;1;1
23/11/2018;1,06606E+18;"Only $15/year! Subscribe to Practical Homeschooling magazine &amp; get your 1st issue FAST via First Class mail. Plus,… https://t.co/Vdh5wZxDUC";1;1;0
23/11/2018;1,06606E+18;"BLACK FRIDAY WEEKEND DEAL on this award-winning online math curriculum! Six MONTHS free! 

Dr. Janelle, a homeschoo… https://t.co/RYxUQZpVTg";0;3;3
23/11/2018;1,06606E+18;"Up your ELA success with this proven strategy...
 <U+0001F449> https://t.co/4wn9pIjZ2j 
.
#education #grammar #writing… https://t.co/CWnTimcT3B";0;2;2
23/11/2018;1,06606E+18;"Happy Friday! Time for <U+2615><U+FE0F> Homeschool Coffee Talk <U+0001F31F>
Moving FB Lives to this page <U+0001F60A>
Let’s catch up &amp; chat about getti… https://t.co/DWUIQ3cNPs";0;1;1
23/11/2018;1,06606E+18;Encourage kids to learn at home with Exemplar Education. #education #homeed #homeschool https://t.co/jSE8TjTG10 https://t.co/VHQCgLEyZ9;0;2;2
23/11/2018;1,06606E+18;These look like so much fun! DIY Teen Holiday Decorations https://t.co/fF0sQYdugx https://t.co/WFlkfaSCu9;0;2;2
23/11/2018;1,06606E+18;How to Encourage Reading in a Homeschool Setting https://t.co/UlrVr7x7QX #homeschool #college #highereducation #read;0;1;1
23/11/2018;1,06606E+18;Friday freebies! Enjoy a full day of free resources to help you in your Homeschooling for College Credit journey!… https://t.co/G9hvfpPIey;0;2;2
23/11/2018;1,06606E+18;Free Christmas Concert (featuring portions of Handel's Messiah) this Saturday and Sunday at Village Seven Presbyter… https://t.co/6BNAxxUocv;0;1;1
23/11/2018;1,06606E+18;Using kids for ‘likes’ makes you a lousy social media stage mom https://t.co/FmPPMexFCO via @nypost;1;1;0
23/11/2018;1,06605E+18;@ExvieEsther Also, our homeschool curriculum taught us that compliments should be treated like hot potatoes. We dar… https://t.co/4vQnw9FA5M;0;2;2
23/11/2018;1,06605E+18;VIDEO: TI-Nspire Mini-Tutorial: Graphing a box-and-whisker plot. In this TI Nspire tutorial the Spreadsheet and Sta… https://t.co/KmVAIWN97T;1;0;-1
23/11/2018;1,06605E+18;@StarshipJudy @vickibarkley @C_Stroop @Nicoxw1 @AndieEames Ewwww. Yeah, I’d put that in the abuse category. Emotion… https://t.co/0MHescJbvc;1;0;-1
23/11/2018;1,06605E+18;"This weekends project. Gonna be cold and rainy tomorrow so this will be perfect.

#homeschool 
#raspberrypi 

Lesso… https://t.co/wYpzs0OdCT";1;1;0
23/11/2018;1,06605E+18;@eveewing @estarianne No I haven't. Just googled it. That's horrific. I homeschool my kids, so I've just added this… https://t.co/DV77GrFWA5;1;0;-1
23/11/2018;1,06605E+18;Free resources for teaching kids water safety. #education #parenting #homeschool https://t.co/hT8EqYByTv;0;1;1
23/11/2018;1,06605E+18;"@RepThomasMassie I am pro-2A and this is a BAD idea.

Start homeschooling, folks.";1;0;-1
23/11/2018;1,06605E+18;"Select styles are on sale all weekend long here at #BooksByTheFoot! Take 40% off Red, Purple &amp; Distressed Art by th… https://t.co/AUnF7E4rfK";1;0;-1
23/11/2018;1,06605E+18;Free Christmas 120 Number Charts for Young Math St... https://t.co/KxxO78LcKm #education #homeschool #math #free… https://t.co/eRIPPEphpa;0;2;2
23/11/2018;1,06605E+18;This is why I love homeschooling so much!!!! https://t.co/aLS6d1nYAY;0;1;1
23/11/2018;1,06605E+18;@TheTestyTarheel @RubyRockstar333 Why intelligent parents homeschool, as the figured out that this is war upon our… https://t.co/hXZlKjzfgR;0;1;1
23/11/2018;1,06605E+18;School bars mom from entering after she objected to gay ‘pride’ event for 5-year-olds | News | LifeSite… https://t.co/wgDXDs8gM0;0;1;1
23/11/2018;1,06605E+18;"GRAB A FAMILY SUBSCRIPTION IN OUR BLACK FRIDAY SALE!
Support learning at home the fun way with Busy Things!… https://t.co/idPmotau0Q";0;2;2
23/11/2018;1,06605E+18;My favorite way to relax after a long homeschooling day is ...  #homeschool;0;1;1
23/11/2018;1,06605E+18;"@dbledford13 Serious question:

How do you know that everyone who goes to college (where there are a variety of tea… https://t.co/jr2U1k9cIq";0;1;1
23/11/2018;1,06605E+18;@nicholson3737 @jpbuttrfly @authentic_april @RODRIGOMENDIO17 @WNCN You are so right. Prior to Trump, my nieces and… https://t.co/RJfxOWh1H1;0;2;2
23/11/2018;1,06605E+18;"A reviewer said: \My son loves this, he is a problem solver and this is the only math I have ever tried that he act… https://t.co/wfCbmj5InE""";1;1;0
23/11/2018;1,06605E+18;"New on ebay: Glencoe Algebra 2 CDs Student Interactive Classroom Super DVD Homeschool 
 https://t.co/x6WtZsUpNo https://t.co/nhkeKuXnNR";0;1;1
23/11/2018;1,06605E+18;@canibud @RepThomasMassie They are great because I homeschool... Why should my kids be subjected to public school t… https://t.co/uhITCBtWly;1;1;0
23/11/2018;1,06605E+18;".@ThomasEWoods is doing a massive sale for Liberty Classroom; half off lifetime membership. 23+ courses, 435 extra… https://t.co/SPSP5Jnz9X";0;1;1
23/11/2018;1,06604E+18;More Gratitude Means Less Stress https://t.co/jWgjLaftSf via  @RickWarren #homeschool #gratitude;1;2;1
23/11/2018;1,06604E+18;"Play a magic math trick on your friends; learn more here! https://t.co/zrvmgplcCQ math Learningmole homeschooling k… https://t.co/APmYTfF3aw";1;1;0
23/11/2018;1,06604E+18;Mental math trick for the kids to trick their friends! https://t.co/wXXEdHKbKk #math #tricks #magic #Learningmole… https://t.co/3aXiLQtPoN;2;1;-1
23/11/2018;1,06604E+18;Looking for a great holiday unit study? Check out the Christmas Unit Study from Homeschool Complete. And there is a… https://t.co/maMU80gZBx;0;1;1
23/11/2018;1,06604E+18;@canibud @RepThomasMassie C, C++. Not to mention my daughter builds robots for fun. Last year we built a computer,… https://t.co/KAshgl3wlC;0;1;1
23/11/2018;1,06604E+18;i got a good 5 years to turn my life around so i can afford to homeschool my brother;0;2;2
23/11/2018;1,06604E+18;"Black Friday Sale TODAY &amp; TODAY ONLY! 40% off and free shipping FOR orders $75+
https://t.co/yRYwLNyd6F… https://t.co/5hXUrfYxGl";0;1;1
23/11/2018;1,06604E+18;Homeschooling kids no longer considered the crazy option https://t.co/Wb42hJFBTG;1;0;-1
23/11/2018;1,06604E+18;Free Number Worksheets: Write, Trace, Frame, Count, Tally and more....@PreKMoms #homeschooling #kinderhttps://kinde… https://t.co/fvx2hXG8dv;0;1;1
23/11/2018;1,06604E+18;5 Reasons to Love Literature Based Homeschool Curriculum - Natural Beach Living https://t.co/2p5Dlhjcew;0;1;1
23/11/2018;1,06604E+18;I Know My Rights: A Children's Guide to the Bill of Rights and Individual Liberty is a fantastic tool to help kids… https://t.co/UEfgCToaYJ;0;2;2
23/11/2018;1,06604E+18;@LifeWithCarmenC @ChrystalHurst Agreed...best decision. We have 5 children and we are a homeschool family. I spent… https://t.co/AhmrxHkpMI;0;1;1
23/11/2018;1,06604E+18;How to be Successful in a Literature-Based Homeschool https://t.co/qjTUCd4Mj8 via @bethanyishee;0;1;1
23/11/2018;1,06604E+18;These science kits are perfect kids activities, curriculum for a teacher or even for a homeschool classroom. https://t.co/1xKCNV4TBZ;0;1;1
23/11/2018;1,06603E+18;“In the early years of Okla #homeschooling, parents tended to be more concerned with religious issues and having mo… https://t.co/Q6fK8BXL65;2;0;-2
23/11/2018;1,06603E+18;@ICT_Pinup @StarshipJudy @Nicoxw1 @AndieEames And homeschooling was much more strictly regulated into the 1980s. Th… https://t.co/aHnqe5ZX25;1;0;-1
23/11/2018;1,06603E+18;Making learning fun https://t.co/56FQXN00bN #LearningAndDevelopment #homeschool #OutdoorClassroomDay https://t.co/5SoyWXmY63;0;1;1
23/11/2018;1,06603E+18;"Brooklyn’s Top Tutoring Academy.
Weekend Homework Help. Available Monday to Saturday.
693 E 43rd. ST - Brooklyn, NY… https://t.co/pQxoURcApq";0;2;2
23/11/2018;1,06603E+18;150 Giveaway! Plus 150 Educational Gifts Disguised as FUN! #Homeschooling https://t.co/R65soISBwU;0;1;1
23/11/2018;1,06603E+18;Inspiring and guiding the next generation of creative minds. #librarians #homeschooling #amwriting #authorlife… https://t.co/wnlif65jmr;0;2;2
23/11/2018;1,06603E+18;"<U+0001F440> How Can I Recognize a Gifted Learner? <U+0001F49C>
Gifted children will frequently work at least two grade levels above thei… https://t.co/8xxh0FII2k";0;3;3
23/11/2018;1,06603E+18;Here’s an awesome free download for Black Friday :)  Check out “Homeschooling for College Credit”!  Let us know how… https://t.co/R57s5g9ZeF;0;2;2
23/11/2018;1,06603E+18;Artist study: John James Audubon (with free printables) - The Usual Mayhem https://t.co/2Beokor8yE #ihsnet… https://t.co/eHNj0QbDTi;0;1;1
23/11/2018;1,06603E+18;TestPoint™ Placement Testing Service - Online Test with Immediate Results - great for #homeschooling #homeschool… https://t.co/xegGHCYe4P;0;1;1
23/11/2018;1,06603E+18;Live on-line classes with exceptional teachers, great content and interaction AND on-sale? Yes, please! https://t.co/c4e74bCizk;0;2;2
23/11/2018;1,06603E+18;Live on-line classes with exceptional teachers, great interaction and content AND on-sale? Yes, please! https://t.co/c4e74bCizk;0;2;2
23/11/2018;1,06603E+18;@ShooguhLipz @GenevaChristie @akaSassinak @Siubhan_H @Aleen @afwaller @SteamLaundry Homeschool... it’s better anyways;0;1;1
23/11/2018;1,06603E+18;Do anyone ever think about homeschooling their child? — feeling optimistic;0;1;1
23/11/2018;1,06603E+18;The beautiful thing about #homeschooling is that we can really take the time to discover our children’s talents and desires.;0;2;2
23/11/2018;1,06603E+18;@Skmclogger Nice pic! I thought of you and your homeschool group today. Amscope is a microscope manufacturer and th… https://t.co/07n1WYkkCW;0;1;1
23/11/2018;1,06603E+18;my immune system really is just trash thanks homeschool;1;0;-1
23/11/2018;1,06603E+18;New years are a great time to make a fresh start and work on organization, even in your #homeschool. It's not too l… https://t.co/QIoCvBPNQl;0;3;3
23/11/2018;1,06602E+18;Creative Homeschooling: Fall Themed Free Math Pack https://t.co/FQwLxFohtk;1;2;1
